,starters,subGroup
14988,   Seek help to,relationships_2
14989,    Couples ' counseling,relationships_2
14990,Try having a conversation,relationships_2
14991,  A few questions,relationships_2
14992,I'd also like to,relationships_2
14993,"And , why are",relationships_2
14994,  Sooner or later,relationships_2
14995,"  Instead , try",relationships_2
14996,The best way to,relationships_2
14997,It is possible to,relationships_2
14998,  What you each,relationships_2
14999,Sending lots of luck,relationships_2
15000,You ca n't fix,relationships_2
15001,One person working hard,relationships_2
15002,I 'm reading between,relationships_2
15003,I sense that you,relationships_2
15004,  I have worked,relationships_2
15005,But in order for,relationships_2
15006,Your boyfriend does n't,relationships_2
15007,Can you be honest,relationships_2
15008,I encourage you to,relationships_2
15009,I wish you well,relationships_2
15010,The dynamics of having,relationships_2
15011,Sometimes we jump from,relationships_2
15012,When you find yourself,relationships_2
15013,Is the person afraid,relationships_2
15014,Are they jealous of,relationships_2
15015,Do you feel the,relationships_2
15016,How long and/or how,relationships_2
15017,Does your former partner,relationships_2
15018,Some of these questions,relationships_2
15019,You likely want to,relationships_2
15020,Other friends might be,relationships_2
15021,You will want to,relationships_2
15022,Also perhaps think about,relationships_2
15023,Has there been a,relationships_2
15024,How it will it,relationships_2
15025,Ultimately you choose who,relationships_2
15026,No one else can,relationships_2
15027,"However , gaining the",relationships_2
15028,"In your heart ,",relationships_2
15029,Learn to trust that,relationships_2
15030,Use your mind to,relationships_2
15031,The answer will arrive,relationships_2
15032,It sounds like you,relationships_2
15033,  The ability to,relationships_2
15034,  If your partner,relationships_2
15035,It sounds like you,relationships_2
15036,  Do you typically,relationships_2
15037,"If so , it",relationships_2
15038,  If any separation,relationships_2
15039,  Think about what,relationships_2
15040,  If you examine,relationships_2
15041,   It is important,relationships_2
15042,Are there dating sites,relationships_2
15043,  At least one,relationships_2
15044,All the rejection on,relationships_2
15045,How do you know,relationships_2
15046,Any reason is possible,relationships_2
15047,Unless you 've heard,relationships_2
15048,I agree with Sherry,relationships_2
15049,These questions help couples,relationships_2
15050,It 's based on,relationships_2
15051,How he responds to,relationships_2
15052,If your partner responds,relationships_2
15053,If he responds in,relationships_2
15054,"Either way , you",relationships_2
15055,If he continues to,relationships_2
15056,I think honesty is,relationships_2
15057,Share with him that,relationships_2
15058,Trust is the foundation,relationships_2
15059,"Hopefully , he will",relationships_2
15060,This also might be,relationships_2
15061,The best way to,relationships_2
15062,I would defintely  ,relationships_2
15063,Allow him to explain,relationships_2
15064,Try to ask him,relationships_2
15065,Just ask him .,relationships_2
15066,I'm not sure how,relationships_2
15067,"Therefore , I think",relationships_2
15068,I do n't know,relationships_2
15069,Long distance relationships are,relationships_2
15070,"Talking , texting ,",relationships_2
15071,It may be time,relationships_2
15072,Do you both want,relationships_2
15073,If one of you,relationships_2
15074,Trust is important .,relationships_2
15075,"Issues with trust ,",relationships_2
15076,I know confrontation of,relationships_2
15077,Evaluate your true feelings,relationships_2
15078,Are you with him,relationships_2
15079,Has he ever given,relationships_2
15080,"Some people , unfortunately",relationships_2
15081,"However , if this",relationships_2
15082,  It may be,relationships_2
15083,This may result in,relationships_2
15084,"Or , it could",relationships_2
15085,I know that can,relationships_2
15086,If you 'd like,relationships_2
15087,You 're definitely entitled,relationships_2
15088,Often people are afraid,relationships_2
15089,In the short term,relationships_2
15090,In the long term,relationships_2
15091,You are asking a,relationships_0
15092,Although maintaining a long,relationships_0
15093,Without knowing more about,relationships_0
15094,Has he cheated on,relationships_0
15095,"  Or , is",relationships_0
15096,Knowing that distinction is,relationships_0
15097,The more you focus,relationships_0
15098,"  However , if",relationships_0
15099,To help the conversation,relationships_0
15100,Is that you wish,relationships_0
15101,For many of my,relationships_0
15102,It 's hard to,relationships_0
15103,"Other times , it",relationships_0
15104,"Regular communication , understanding",relationships_0
15105,  Dr. Virginia Chowwww.PsychologyResource.ca,relationships_0
15106,Loving someone in the,relationships_0
15107,My husband and I,relationships_0
15108,How long do you,relationships_0
15109,Do you have access,relationships_0
15110,How far away from,relationships_0
15111,Can you meet half,relationships_0
15112,I have a number,relationships_0
15113,They pick a restaurant,relationships_0
15114,It 's super cute,relationships_0
15115,What are some things,relationships_0
15116,You 're wise to,relationships_0
15117,All you both can,relationships_0
15118,is state your intentions,relationships_0
15119,To a large degree,relationships_0
15120,   The military may,relationships_0
15121,This does n't necessarily,relationships_0
15122,Sometimes all anyone is,relationships_0
15123,You 're right that,relationships_0
15124,If he loves you,relationships_0
15125,I wonder if you,relationships_0
15126,When having important discussions,relationships_0
15127,Asking more questions in,relationships_0
15128,When having discussions face,relationships_0
15129,As for how that,relationships_0
15130,"For example , are",relationships_0
15131,I do n't want,relationships_0
15132,Can I share them,relationships_0
15133,"In doing so ,",relationships_0
15134,Gary Chapman is famous,relationships_0
15135,He has one specifically,relationships_0
15136,Here 's a list,relationships_0
15137,One final tip :,relationships_0
15138,These memories could be,relationships_0
15139,Best wishes to you,relationships_0
15140,Remember that you could,relationships_0
15141,A rare topic &,relationships_3
15142,I would need to,relationships_3
15143,Feel free to email,relationships_3
15144,I would also like,relationships_3
15145,  Partners need each,relationships_3
15146,We women really do,relationships_0
15147,And Hollywood culture has,relationships_0
15148,It 's been my,relationships_0
15149,So you might try,relationships_0
15150,For example : Where,relationships_0
15151,  Why do n't,relationships_0
15152,I promise this tends,relationships_0
15153,Were you ever intimately,relationships_0
15154,"Now , IF she",relationships_0
15155,And if you really,relationships_0
15156,  Bottom line -,relationships_0
15157,  And would continue,relationships_0
15158,  AND why you,relationships_0
15159,  This will help,relationships_0
15160,  Best of luck,relationships_0
15161,"  Tamara Powell ,",relationships_0
15162,Do you know why,relationships_0
15163,Have you blocked the,relationships_0
15164,It is much easier,relationships_0
15165,Whether or not she,relationships_0
15166,All you can be,relationships_0
15167,Keep or reintroduce the,relationships_0
15168,Open and honest communication,relationships_0
15169,Your girlfriend may be,relationships_0
15170,Answer her questions fully,relationships_0
15171,Ask for her suggestions,relationships_0
15172,Ask for your girlfriend,relationships_0
15173,If you are honest,relationships_0
15174,I 'm glad you,relationships_0
15175,One of the terrible,relationships_0
15176,This happens because partners,relationships_0
15177,  Regardless of how,relationships_0
15178,Stick with what your,relationships_0
15179,There is a part,relationships_0
15180,Leaving a relationship is,relationships_0
15181,  People are in,relationships_0
15182,These are secondary matters,relationships_0
15183,Listen to yourself about,relationships_0
15184,Your inner self does,relationships_0
15185,People often care deeply,relationships_1
15186,I do n't know,relationships_1
15187,It is also common,relationships_1
15188,It may be helpful,relationships_1
15189,It may be helpful,relationships_1
15190,"For example , maybe",relationships_1
15191,Sometimes just talking about,relationships_1
15192,You could also consider,relationships_1
15193,I also wonder where,relationships_1
15194,I do n't know,relationships_1
15195,Some people benefit from,relationships_1
15196,I would suggest considering,relationships_1
15197,Also think about what,relationships_1
15198,It may be difficult,relationships_1
15199,Remember that feeling heard,relationships_1
15200,The simplest answer is,relationships_1
15201,Love deepens a sense,relationships_1
15202,Obsessions give anxiety and,relationships_1
15203,One suggestion is to,relationships_1
15204,Maybe you can talk,relationships_2
15205,If you are at,relationships_2
15206,I do n't know,relationships_2
15207,That may be a,relationships_2
15208,Hopefully your partner will,relationships_2
15209,Because of the way,relationships_2
15210,"When you do """,relationships_2
15211,It sounds a bit,relationships_2
15212,I recommend working on,relationships_2
15213,Attention is often something,relationships_0
15214,Maybe when you 're,relationships_0
15215,There are different types,relationships_2
15216,  You said that,relationships_2
15217,Depending on how long,relationships_2
15218,Some people look at,relationships_2
15219,Perhaps with this guy,relationships_2
15220,Maybe you can leave,relationships_2
15221,You said you really,relationships_2
15222,What do you look,relationships_2
15223,There are a lot,relationships_2
15224,Can you have open,relationships_2
15225,Is he able to,relationships_2
15226,I 'm not sure,relationships_2
15227,Which part of you,relationships_2
15228,Can you consider what,relationships_2
15229,Can he do that,relationships_2
15230,The most crucial key,relationships_0
15231,Sounds like you are,relationships_0
15232,That 's why it,relationships_0
15233,He was n't reflecting,relationships_0
15234,"However it ended ,",relationships_0
15235,So here you are,relationships_0
15236,You are n't unworthy,relationships_0
15237,  To be worthy,relationships_0
15238,Often though before anyone,relationships_0
15239,We humans are social,relationships_0
15240,We learn how to,relationships_0
15241,The caregiving you received,relationships_0
15242,Insecurity in relationships often,relationships_0
15243,There are many ways,relationships_0
15244,Next I 'd suggest,relationships_0
15245,How did you come,relationships_0
15246,One way of evaluating,relationships_0
15247,If being by yourself,relationships_0
15248,"This way , when",relationships_0
15249,"Hi ,   First",relationships_1
15250,If the medications are,relationships_1
15251,  As for your,relationships_1
15252,Is it OK ?,relationships_1
15253,Are you OK with,relationships_1
15254,Have you thought through,relationships_1
15255,Opening up a relationship,relationships_1
15256,"Even then , the",relationships_1
15257,  I encourage you,relationships_1
15258,Be clear with the,relationships_1
15259,An excellent resource would,relationships_1
15260,  I wish you,relationships_1
15261,"Lily Zehner , MFT",relationships_1
15262,"Hello , and thank",relationships_1
15263,I completely agree with,relationships_1
15264,Many couples are in,relationships_1
15265,The key thing about,relationships_1
15266,"Now , as Dr.",relationships_1
15267,  The truth is,relationships_1
15268,Here is a good,relationships_1
15269,If you type in,relationships_1
15270,I wish you well,relationships_1
15271,The person who can,relationships_4
15272,   They are the,relationships_4
15273,   What they tell,relationships_4
15274,   It is up,relationships_4
15275,From what you write,relationships_2
15276,What keeps you feeling,relationships_2
15277,Sometimes relationships just do,relationships_2
15278,   Do n't feel,relationships_2
15279,    The one that,relationships_2
15280,   It is good,relationships_2
15281,   It takes times,relationships_2
15282,   I would suggest,relationships_2
15283,   If he wants,relationships_2
15284,   If he doesn't,relationships_2
15285,Hello and thank you,relationships_2
15286,I worked for a,relationships_2
15287,Being involved in a,relationships_2
15288,I was a little,relationships_2
15289,I am going to,relationships_2
15290,Some of the things,relationships_2
15291,Even without physical abuse,relationships_2
15292,When partners question and,relationships_2
15293,   The accusations serve,relationships_2
15294,"For example , if",relationships_2
15295,The person being accused,relationships_2
15296,And that brings me,relationships_2
15297,  Here are just,relationships_2
15298,They realize there is,relationships_2
15299,Trying to be logical,relationships_2
15300,Many people simply stop,relationships_2
15301,"In addition , the",relationships_2
15302,And this can leave,relationships_2
15303,   2 .  ,relationships_2
15304,Finding a support group,relationships_2
15305,One of the things,relationships_2
15306,Surrounding yourself with people,relationships_2
15307,  They reinvest in,relationships_2
15308,Try to find some,relationships_2
15309,This could n't possibly,relationships_2
15310,Whether that is taking,relationships_2
15311,One thing that can,relationships_2
15312,Taking some time for,relationships_2
15313,I do n't know,relationships_2
15314,"If not , there",relationships_2
15315,It 's important to,relationships_2
15316,As for the question,relationships_2
15317,But you could ask,relationships_2
15318,What are some of,relationships_2
15319,Do   I  ,relationships_2
15320,Ask yourself if you,relationships_2
15321,Do I feel like,relationships_2
15322,If I want to,relationships_2
15323,Hope some of these,relationships_2
15324,Good luck to you,relationships_2
15325,"Robin Landwehr , DBH",relationships_2
15326,You 'll only find,relationships_4
15327,Regardless of whether the,relationships_4
15328,It 's never to,relationships_4
15329,   You never know,relationships_4
15330,   You do n't,relationships_4
15331,   That can be,relationships_4
15332,   Now prepare for,relationships_4
15333,   If they are,relationships_4
15334,   If they are,relationships_4
15335,It sounds like you,relationships_3
15336,If you really want,relationships_3
15337,If you do n't,relationships_3
15338,I get the sense,relationships_3
15339,In the early stage,relationships_3
15340,It 's not personal,relationships_3
15341,You do n't owe,relationships_3
15342,They deserve someone who,relationships_3
15343,You do n't have,relationships_3
15344,It actually creates more,relationships_3
15345,Maybe people do n't,relationships_3
15346,I wish you the,relationships_3
15347,  Life is too,relationships_3
15348,I have learned that,relationships_3
15349,   If you make,relationships_3
15350,Why do n't you,relationships_3
15351,Unless you have a,relationships_3
15352,Good luck in having,relationships_3
15353,Give him the time,relationships_2
15354,   Obviously something is,relationships_2
15355,   Respect that most,relationships_2
15356,If and when he,relationships_2
15357,   When and if,relationships_2
15358,   Do n't take,relationships_2
15359,   If you do,relationships_2
15360,Your boyfriend may like,relationships_2
15361,People have different styles,relationships_2
15362,One point you can,relationships_2
15363,He 's entitled to,relationships_2
15364,Cooperating with the other,relationships_2
15365,Since the anti -,relationships_2
15366,This seems like two,relationships_2
15367,  The first is,relationships_2
15368,  The second is,relationships_2
15369,  Both give you,relationships_2
15370,  Having expectations can,relationships_2
15371,  I write about,relationships_2
15372,  Is there any,relationships_2
15373,  Are there wonderful,relationships_2
15374,  Can you create,relationships_2
15375,  Are there new,relationships_2
15376,  What are the,relationships_2
15377,"  Again , let",relationships_2
15378,"That 's what """,relationships_2
15379,I am sure this,relationships_2
15380,  ~Mark   (,relationships_2
15381,"Well , as far",relationships_4
15382,   Leaving is not,relationships_4
15383,   However this is,relationships_4
15384,   Having a baby,relationships_4
15385,   This is something,relationships_4
15386,"   Hopefully , someone",relationships_4
15387,"As for you ,",relationships_4
15388,   A lot can,relationships_4
15389,   You have a,relationships_4
15390,   Can you tell,relationships_4
15391,   Nope ! !,relationships_4
15392,   As I always,relationships_4
15393,   Develop healthy friendships,relationships_4
15394,   Your support system,relationships_4
15395,   Stay focus on,relationships_4
15396,Sounds like you are,relationships_3
15397,   I would suggest,relationships_3
15398,   Then getting a,relationships_3
15399,   Seeing both would,relationships_3
15400,     After getting these,relationships_3
15401,   Whether treatment includes,relationships_3
15402,   Please consider doing,relationships_3
15403,Or ... better yet,relationships_1
15404,Is it you still,relationships_1
15405,   I am sure,relationships_1
15406,   Make sure the,relationships_1
15407,   Sounds like something,relationships_1
15408,"Hey , it might",relationships_2
15409,Your mom wants to,relationships_2
15410,Maybe she is worried,relationships_2
15411,Were you hurt in,relationships_2
15412,Can you understand where,relationships_2
15413,Sometimes when we 're,relationships_2
15414,Can you help your,relationships_2
15415,She might need help,relationships_2
15416,  Thank your mom,relationships_2
15417,I am less concerned,relationships_4
15418,  You are in,relationships_4
15419,  If you have,relationships_4
15420,  While this man,relationships_4
15421,  It sounds like,relationships_4
15422,  I would suggest,relationships_4
15423,This is not your,relationships_4
15424,But you are in,relationships_4
15425,  Take care .,relationships_4
15426,That sounds really heartbreaking,relationships_0
15427,It is tough falling,relationships_0
15428,It sounds to me,relationships_0
15429,While I admire your,relationships_0
15430,Since there is no,relationships_0
15431,Make sure that you,relationships_0
15432,Love does n't hurt,relationships_0
15433,Your description of the,relationships_0
15434,"In some relationships ,",relationships_0
15435,This sounds more descriptive,relationships_0
15436,  Your descriptions are,relationships_0
15437,Try distinguishing your wishes,relationships_0
15438,Being aware of how,relationships_0
15439,Your ongoing emotional wear,relationships_0
15440,The relationship is very,relationships_0
15441,  It sounds like,relationships_0
15442,"Hi Miami , I",relationships_4
15443,We live in a,relationships_4
15444,I believe that our,relationships_4
15445,  Your friend came,relationships_4
15446,He is wise to,relationships_4
15447,Therapy can help .,relationships_4
15448,So you fell in,relationships_4
15449,He 's taking the,relationships_4
15450,I love that you,relationships_4
15451,This decision is his,relationships_4
15452,"  For yourself ,",relationships_4
15453,Many marriages do n't,relationships_4
15454,You flirted with danger,relationships_4
15455,You fell in love,relationships_4
15456,I 'm sure his,relationships_4
15457,It 's one man,relationships_4
15458,You can focus on,relationships_4
15459,We flirted with danger,relationships_4
15460,I know he does,relationships_4
15461,I can feel really,relationships_4
15462,I feel proud of,relationships_4
15463,I feel proud if,relationships_4
15464,Acknowledge and allow yourself,relationships_4
15465,It 's real .,relationships_4
15466,If you have told,relationships_4
15467,I wish you well,relationships_4
15468,"Hi Athens , When",relationships_2
15469,Do you maybe hope,relationships_2
15470,It does n't work,relationships_2
15471,Do you yearn for,relationships_2
15472,Babies do n't give,relationships_2
15473,I urge you to,relationships_2
15474,A relationship that is,relationships_2
15475,You 're only starting,relationships_2
15476,I wish you well,relationships_2
15477,Given that both you,relationships_0
15478,Suddenly being without a,relationships_0
15479,  Stay focused on,relationships_0
15480,From what you describe,relationships_0
15481,If and when you,relationships_0
15482,Who knows?It is possible,relationships_0
15483,Good luck with Step,relationships_0
15484,"Hold on , Sanger",relationships_3
15485,"You know , I",relationships_3
15486,I do n't think,relationships_3
15487,If your ex is,relationships_3
15488,Your partner feels powerless,relationships_3
15489,Of course he does,relationships_3
15490,Accept the powerlessness .,relationships_3
15491,Lean into it .,relationships_3
15492,"It 's okay ,",relationships_3
15493,He has the power,relationships_3
15494,That 's HUGE .,relationships_3
15495,That 's why he,relationships_3
15496,I bet the main,relationships_3
15497,That 's his ex,relationships_3
15498,Ending a marriage in,relationships_3
15499,He has not intentionally,relationships_3
15500,Hopefully he 's aware,relationships_3
15501,He has the power,relationships_3
15502,He 's not doing,relationships_3
15503,He 's still reacting,relationships_3
15504,He has n't completely,relationships_3
15505,A good therapist can,relationships_3
15506,He needs your support,relationships_3
15507,I wish you the,relationships_3
15508,"New York , what",relationships_0
15509,Is that the only,relationships_0
15510,Your self respect does,relationships_0
15511,She simply does n't,relationships_0
15512,Move on and heal,relationships_0
15513,"First off , I",relationships_0
15514,I think that the,relationships_0
15515,You can also help,relationships_0
15516,Know that you wo,relationships_0
15517,Regarding your question about,relationships_0
15518,If you care for,relationships_0
15519,Be careful that you,relationships_0
15520,Good luck to you,relationships_0
15521,It sounds like there,relationships_2
15522,Do you know what,relationships_2
15523,"A friendship only ,",relationships_2
15524,I would encourage you,relationships_2
15525,Ask him to be,relationships_2
15526,Be mentally prepared  ,relationships_2
15527,By clearing the air,relationships_2
15528,"Without that clarification ,",relationships_2
15529,Love is not enough,relationships_0
15530,The people need to,relationships_0
15531,Let 's start with,relationships_0
15532,The frequent break ups,relationships_0
15533,  Try understanding more,relationships_0
15534,You state a few,relationships_0
15535,Trust your intuition telling,relationships_0
15536,Sometimes men are n't,relationships_0
15537,"Also , hoping a",relationships_0
15538,Control has nothing to,relationships_0
15539,"Hi Kansas , I",relationships_0
15540,"You deserve respect ,",relationships_0
15541,It 's appropriate now,relationships_0
15542,  Do you think,relationships_0
15543,"This a common ,",relationships_0
15544,  I wonder if,relationships_0
15545,The   bottom  ,relationships_0
15546,I hope you gather,relationships_0
15547,Sorry to hear about,relationships_0
15548,You're on the right,relationships_0
15549,Since he was the,relationships_0
15550,This is always a,relationships_0
15551,Understand within yourself whether,relationships_0
15552,"If yes , then",relationships_0
15553,"For example , some",relationships_0
15554,Recuperating after a cheating,relationships_0
15555,If he tells you,relationships_0
15556,"As results unfold ,",relationships_0
15557,About the girl at,relationships_0
15558,She has her greatest,relationships_0
15559,As you go along,relationships_0
15560,It is completely understandable,relationships_3
15561,It 's also understandable,relationships_3
15562,I 'm sure that,relationships_3
15563,There is no magic,relationships_3
15564,In working with a,relationships_3
15565,Though there is no,relationships_3
15566,"Either way , you",relationships_3
15567,Every living creature needs,relationships_4
15568,The dog is in,relationships_4
15569,  This may explain,relationships_4
15570,  Have you spoken,relationships_4
15571,  A   lot,relationships_4
15572,If it is affordable,relationships_4
15573,  The person would,relationships_4
15574,It is extremely frustrating,relationships_2
15575,"Often times , arguments",relationships_2
15576,  Try having a,relationships_2
15577,Communicate how you feel,relationships_2
15578,"Addionally , give him",relationships_2
15579,"Lastly , consider seeing",relationships_2
15580,Best of luck .,relationships_2
15581,"Hi Moore , Underneath",relationships_2
15582,The hurt is there,relationships_2
15583,Your boyfriend ( unless,relationships_2
15584,This is happening because,relationships_2
15585,he has right now,relationships_2
15586,You can expect more,relationships_2
15587,  You could try,relationships_2
15588,I hope you talk,relationships_2
15589,"Oh Chino , I",relationships_0
15590,There 's a chicken,relationships_0
15591,One thing I see,relationships_0
15592,Can you accept that,relationships_0
15593,Is there any real,relationships_0
15594,Remember that texting his,relationships_0
15595,Has he earned your,relationships_0
15596,"If so , then",relationships_0
15597,He 's not your,relationships_0
15598,Reassure your heart that,relationships_0
15599,At the same time,relationships_0
15600,"For example , hiding",relationships_0
15601,"  See , this",relationships_0
15602,   So let him,relationships_0
15603,Transparency helps build trust,relationships_0
15604,"You have sensitivities ,",relationships_0
15605,  Let him know,relationships_0
15606,You may already be,relationships_0
15607,Each of you are,relationships_0
15608,Is the 50 %,relationships_0
15609,"This way , each",relationships_0
